{
  "schema": 1,
  "domain": "battle_sim_scenarios",
  "family": "production",
  "templates": {},
  "entries": [
    {
      "scenario_id": "ai_vs_ai_duel_example",
      "display_name": "AI vs AI Duel Example",
      "description": "用于验证 player/hostile 双方都由 AI 驱动时的整场战斗模拟。",
      "map_size": {
        "x": 6,
        "y": 3
      },
      "terrain_profile_id": "default",
      "use_formal_terrain_generation": false,
      "world_coord": {
        "x": 0,
        "y": 0
      },
      "ally_units": [
        {
          "unit_id": "player_vanguard_ai",
          "source_member_id": "",
          "display_name": "先锋斗士",
          "faction_id": "player",
          "control_mode": "ai",
          "ai_brain_id": "melee_aggressor",
          "ai_state_id": "engage",
          "coord": {
            "x": 0,
            "y": 1
          },
          "body_size": 2,
          "body_size_category": "medium",
          "current_hp": 48,
          "current_mp": 0,
          "current_stamina": 120,
          "current_aura": 0,
          "current_ap": 2,
          "current_move_points": 2,
          "action_threshold": 40,
          "attribute_overrides": {
            "hp_max": 48,
            "stamina_max": 120,
            "action_points": 2,
            "attack_bonus": 6,
            "armor_ac_bonus": 6
          },
          "skill_ids": [
            "basic_attack",
            "charge",
            "warrior_heavy_strike"
          ],
          "skill_level_map": {
            "basic_attack": 1,
            "charge": 1,
            "warrior_heavy_strike": 1
          },
          "movement_tags": [],
          "unlocked_combat_resource_ids": [],
          "weapon_projection": {
            "weapon_profile_kind": "equipped",
            "weapon_item_id": "steel_longsword",
            "weapon_profile_type_id": "longsword",
            "weapon_range_type": "melee",
            "weapon_family": "sword",
            "weapon_current_grip": "one_handed",
            "weapon_attack_range": 1,
            "weapon_one_handed_dice": {
              "dice_count": 1,
              "dice_sides": 8
            },
            "weapon_two_handed_dice": {
              "dice_count": 1,
              "dice_sides": 10
            },
            "weapon_is_versatile": true,
            "weapon_uses_two_hands": false,
            "weapon_physical_damage_tag": "physical_slash"
          },
          "base_attributes": {
            "strength": 14,
            "agility": 12,
            "constitution": 14,
            "perception": 10,
            "intelligence": 8,
            "willpower": 10
          }
        }
      ],
      "enemy_units": [
        {
          "unit_id": "enemy_harrier_ai",
          "source_member_id": "",
          "display_name": "猎压弓手",
          "faction_id": "hostile",
          "control_mode": "ai",
          "ai_brain_id": "ranged_suppressor",
          "ai_state_id": "pressure",
          "coord": {
            "x": 5,
            "y": 1
          },
          "body_size": 2,
          "body_size_category": "medium",
          "current_hp": 42,
          "current_mp": 20,
          "current_stamina": 120,
          "current_aura": 0,
          "current_ap": 2,
          "current_move_points": 2,
          "action_threshold": 40,
          "attribute_overrides": {
            "hp_max": 42,
            "mp_max": 20,
            "stamina_max": 120,
            "action_points": 2,
            "attack_bonus": 6,
            "armor_ac_bonus": 4
          },
          "skill_ids": [
            "basic_attack",
            "archer_suppressive_fire",
            "archer_pinning_shot"
          ],
          "skill_level_map": {
            "basic_attack": 1,
            "archer_suppressive_fire": 1,
            "archer_pinning_shot": 1
          },
          "movement_tags": [],
          "unlocked_combat_resource_ids": [],
          "weapon_projection": {
            "weapon_profile_kind": "equipped",
            "weapon_item_id": "ash_longbow",
            "weapon_profile_type_id": "longbow",
            "weapon_range_type": "ranged",
            "weapon_family": "bow",
            "weapon_current_grip": "two_handed",
            "weapon_attack_range": 4,
            "weapon_one_handed_dice": {
              "dice_count": 0,
              "dice_sides": 0
            },
            "weapon_two_handed_dice": {
              "dice_count": 1,
              "dice_sides": 8
            },
            "weapon_is_versatile": false,
            "weapon_uses_two_hands": true,
            "weapon_physical_damage_tag": "physical_pierce"
          },
          "base_attributes": {
            "strength": 10,
            "agility": 12,
            "constitution": 12,
            "perception": 14,
            "intelligence": 10,
            "willpower": 10
          }
        }
      ],
      "cell_overrides": [],
      "timeline_ticks_per_step": 1,
      "tu_per_tick": 5,
      "max_iterations": 400,
      "manual_policy": "wait",
      "trace_enabled": true,
      "seeds": [
        301,
        302
      ]
    }
  ]
}
